Index,Queries
191,"Analyze the impact of the United and Continental merger on shareholder value, considering pre- and post-merger stock performance and accounting adjustments."
192," Identify all significant legal challenges faced by United Airlines post-Continental merger, detailing the outcomes and financial implications."
193," Quantify the cost savings realized by United Airlines from integrating Continental's operations, specifying areas of overlap and efficiency gains."
194," Assess the antitrust implications of the United-Continental merger, including regulatory scrutiny and any resulting fines or settlements."
195," Evaluate United Airlines' financial reporting practices post-merger, focusing on transparency and compliance with accounting standards."
196," Determine the impact of the United-Continental merger on employee compensation and benefits, analyzing any resulting legal disputes or settlements."
197, Compare the debt structures of United and Continental Airlines pre-merger and assess the impact of the merger on the combined entity's credit rating and borrowing costs.
198,Analyze the financial impact of Delta's acquisition of Northwest Airlines on Delta's debt-to-equity ratio over the subsequent five years.
199,"Identify any legal challenges faced by Delta Air Lines following the Northwest Airlines merger, and the outcomes of those challenges."
200, Assess the antitrust implications of the Delta-Northwest merger as investigated by relevant regulatory bodies.
201, Determine the changes in Delta's financial reporting standards post-merger with Northwest Airlines.
202," Quantify the cost savings realized by Delta from integrating Northwest Airlines' operations, specifying areas of greatest efficiency gains."
203," Examine the impact of the Delta-Northwest merger on employee benefits and compensation packages, highlighting any legal disputes arising from this."
204, Analyze the long-term effects of the Delta-Northwest merger on Delta's market capitalization and shareholder value.
205,Analyze the financial impact of American Airlines' and US Airways' merger on employee compensation and benefits packages.
206," Identify all legal challenges faced by American Airlines and US Airways post-merger, detailing the outcomes."
207,"Determine the antitrust implications of the American Airlines and US Airways merger, focusing on market share and competition."
208,"Assess the financial performance of American Airlines and US Airways individually prior to the merger, comparing key metrics."
209, Evaluate the effectiveness of American Airlines and US Airways' post-merger cost-cutting measures and their impact on profitability.
210, Summarize any significant legal settlements or judgments involving American Airlines or US Airways since their merger.
211,Analyze the changes in American Airlines' and US Airways' debt structure following their merger and assess the long-term financial implications.
212,Analyze the impact of the AirTran Airways acquisition on Southwest Airlines' financial statements for the three years following the merger.
213,Identify all legal challenges faced by Southwest Airlines post-AirTran acquisition and the resulting financial implications.
214,Detail the regulatory approvals required for the Southwest/AirTran merger and the timeline for obtaining them.
215," Assess the financial performance of AirTran Airways prior to the acquisition by Southwest Airlines, highlighting key profitability metrics."
216,Quantify the restructuring costs associated with integrating AirTran's operations into Southwest's.
217, Evaluate Southwest Airlines' debt levels and credit ratings before and after the AirTran acquisition.
218,Summarize any significant legal settlements or lawsuits involving Southwest Airlines related to the AirTran integration.
219,Analyze the impact of Alaska Airlines' acquisition of Virgin America on its debt-to-equity ratio over the past five years.
220, Detail any legal challenges or antitrust concerns faced by Alaska Airlines following its merger with Virgin America.
221," Compare the pre- and post-merger financial performance of Alaska Airlines and Virgin America, focusing on profitability metrics."
222, Assess the effectiveness of Alaska Airlines' post-merger integration strategies concerning employee retention and operational efficiency.
223, Identify any significant changes in Alaska Airlines' financial reporting practices following the Virgin America acquisition.
224, Evaluate the long-term financial implications of Alaska Airlines' acquisition of Virgin America on its overall market capitalization.
225, Summarize all legal settlements or lawsuits involving Alaska Airlines related to the Virgin America merger.
226,Analyze JetBlue's and Spirit's financial statements for the past three years to identify key performance indicators (KPIs) relevant to a potential merger.
227,"Summarize any ongoing or past legal challenges faced by either JetBlue or Spirit, including antitrust concerns or consumer lawsuits."
228,"Evaluate the potential antitrust implications of a JetBlue-Spirit merger, considering market concentration and competitive landscape."
229,"Assess the financing structure of the proposed JetBlue-Spirit merger, including debt levels, equity contributions, and potential impact on credit ratings."
230, Detail the regulatory approvals required for the JetBlue-Spirit merger and the potential timeline for securing them.
231,"Identify potential tax liabilities or benefits arising from the JetBlue-Spirit merger, considering both US and international tax laws."
232,"Analyze the impact of the proposed merger on the employee workforce of both JetBlue and Spirit Airlines, including potential job losses or restructuring."
233,"Analyze the legal challenges faced by Boeing and McDonnell Douglas during their merger, focusing on antitrust concerns and regulatory approvals."
234, Detail the financial impact of the Boeing-McDonnell Douglas merger on employee pensions and benefits.
235," Assess the long-term financial performance of Boeing post-McDonnell Douglas acquisition, comparing it to projected synergies."
236, Identify any significant legal disputes arising from the Boeing-McDonnell Douglas merger and their resolution.
237," Compare the pre- and post-merger capital structures of Boeing, highlighting changes in debt, equity, and credit ratings."
238," Evaluate the tax implications of the Boeing-McDonnell Douglas merger for both companies, including any tax liabilities or benefits."
239," Examine the impact of the Boeing-McDonnell Douglas merger on shareholder value, considering stock price performance and dividend payouts."
240,"What were the initial and ongoing financial commitments of Airbus in the A220 program, broken down by year?"
241, Analyze the legal agreements between Airbus and Bombardier regarding intellectual property rights related to the A220.
242, Detail the financial impact of any government subsidies received by Bombardier (and later Airbus) for the CSeries/A220 program.
243," Assess the financial performance of the A220 program (including revenue, costs, and profitability) since Airbus' acquisition."
244, Identify and summarize all significant legal challenges or disputes related to the CSeries/A220 program's development or sales.
245, What were the key financial terms of the Airbus-Bombardier agreement regarding the A220 program transfer?
246, Analyze the impact of tariffs or trade disputes on the A220's financial performance in specific markets.
247,Analyze Raytheon Technologies' post-merger SEC filings for instances of accounting irregularities or potential violations of financial reporting standards.
248," Determine the tax implications of the Raytheon and United Technologies merger, detailing any adjustments made to reported earnings due to the transaction."
249," Assess the impact of the Raytheon Technologies merger on the credit ratings of the combined entity, comparing pre- and post-merger ratings and rationale."
250," Summarize all litigation involving Raytheon Technologies since the merger, focusing on the nature of the claims and financial settlements."
251," Compare Raytheon Technologies' capital expenditure (CAPEX) plans before and after the merger, highlighting any shifts in strategic investment priorities."
252," Evaluate the effectiveness of Raytheon Technologies' post-merger debt management strategy, examining its debt-to-equity ratio and interest coverage ratio over time."
253," Identify any significant changes in Raytheon Technologies' shareholder structure since the merger, and analyze the implications for corporate governance."
254,"Analyze Lockheed Martin's and Sikorsky's financial statements for the past five years to identify trends in profitability, debt levels, and cash flow."
255," Assess the legal implications of Sikorsky's acquisition by Lockheed Martin, including antitrust concerns and regulatory approvals."
256, Determine the impact of recent legal settlements or lawsuits on Lockheed Martin's and Sikorsky's financial performance.
257, Compare the financial ratios of Lockheed Martin and Sikorsky to their industry peers to assess their relative financial health.
258, Evaluate the effectiveness of Lockheed Martin's and Sikorsky's internal controls over financial reporting.
259, Identify potential financial risks associated with Lockheed Martin's and Sikorsky's government contracts.
260," Analyze the tax implications of Lockheed Martin's ownership of Sikorsky, including any potential tax liabilities or benefits."
261,"Analyze Northrop Grumman's and Orbital ATK's financial statements from the last five years, identifying trends in profitability, debt levels, and capital expenditures."
262," What were the legal challenges faced by Orbital ATK prior to its acquisition by Northrop Grumman, and how were they resolved?"
263,Detail the financial impact of the Northrop Grumman-Orbital ATK merger on Northrop Grumman's stock price in the first two years post-merger.
264, Identify any significant litigation involving Northrop Grumman or Orbital ATK (pre or post-merger) that impacted their financial performance.
265, Assess the tax implications of the Northrop Grumman-Orbital ATK merger for both companies.
266, Compare the debt-to-equity ratios of Northrop Grumman before and after the acquisition of Orbital ATK.
267, Summarize the regulatory approvals required for the Northrop Grumman-Orbital ATK merger and any associated delays or challenges.
268,"Analyze General Dynamics' and CSRA's financial statements for the past five years to identify trends in revenue, profitability, and debt levels."
269, Assess the legal implications of any past acquisitions or divestitures undertaken by General Dynamics or CSRA.
270, Identify and analyze any significant litigation or regulatory investigations involving General Dynamics or CSRA in the last decade.
271," Compare the capital structure and credit ratings of General Dynamics and CSRA, highlighting any significant differences."
272," Evaluate the tax strategies employed by General Dynamics and CSRA, assessing potential risks associated with these strategies."
273, Examine the shareholder activism and proxy battles involving either General Dynamics or CSRA over the past 10 years.
274," Determine the compliance of General Dynamics and CSRA with relevant accounting standards (e.g., GAAP or IFRS) and reporting regulations."
275,"Analyze L3Harris Technologies' and Aerojet Rocketdyne's financial statements for the past three years to identify trends in revenue, profitability, and debt levels."
276, Assess the legal implications of any potential antitrust concerns resulting from a past or hypothetical merger between L3Harris Technologies and Aerojet Rocketdyne.
277, Identify and quantify any material liabilities faced by either L3Harris Technologies or Aerojet Rocketdyne based on their most recent SEC filings.
278,"Compare the capital structure (debt-to-equity ratio, interest coverage ratio) of L3Harris Technologies and Aerojet Rocketdyne to their industry peers."
279, Examine any significant legal disputes or litigation involving either L3Harris Technologies or Aerojet Rocketdyne in the past five years.
280, Analyze the impact of recent government regulations on the financial performance of L3Harris Technologies and Aerojet Rocketdyne.
281, Evaluate the effectiveness of L3Harris Technologies' and Aerojet Rocketdyne's internal controls over financial reporting based on their publicly available disclosures.
282,Analyze Leidos' and Dynetics' recent SEC filings to identify any material weaknesses in their internal controls over financial reporting.
283,"Compare and contrast Leidos' and Dynetics' debt structures, including types of debt, interest rates, and maturity dates."
284,Assess the potential legal liabilities faced by Leidos and Dynetics related to government contracts.
285,Evaluate the impact of recent changes in tax laws on the financial performance of Leidos and Dynetics.
286,Determine the key financial covenants in Leidos' and Dynetics' loan agreements and assess their compliance.
287," Analyze Leidos' and Dynetics' litigation history, focusing on the financial impact of any settled or ongoing lawsuits."
288, Compare the financial ratios of Leidos and Dynetics to their industry peers to identify areas of relative strength and weakness.
289," Assess EverWatch's compliance with Sarbanes-Oxley Act (SOX) regulations, detailing any identified shortcomings or areas requiring improvement."
290," Evaluate the legal implications of a potential acquisition of EverWatch by Booz Allen Hamilton, considering antitrust concerns and regulatory hurdles."
291," Compare the financial performance metrics (e.g., return on equity, debt-to-equity ratio) of Booz Allen Hamilton and EverWatch to identify key differences and potential areas of improvement."
292, Determine the impact of recent legal judgments or settlements on Booz Allen Hamilton's financial position and future prospects.
293," Analyze EverWatch’s contracts for potential liabilities, including penalties for non-performance or breach of contract."
294, Examine Booz Allen Hamilton's and EverWatch's lobbying expenditures and political contributions to assess potential legal or reputational risks.
295,Analyze CACI International's and Six3 Systems' historical financial statements to identify any material weaknesses in internal controls over financial reporting.
296," Assess the legal implications of a potential acquisition of Six3 Systems by CACI International, including antitrust concerns and regulatory approvals required."
297," Compare CACI International's and Six3 Systems' debt structures and credit ratings, projecting potential impact on creditworthiness following a hypothetical merger."
298," Determine the financial impact of any existing or potential litigation on CACI International or Six3 Systems, including estimated legal costs and potential liabilities."
299," Evaluate the tax implications for both CACI International and Six3 Systems resulting from a potential merger, considering both short-term and long-term tax liabilities."
300, Analyze CACI International's and Six3 Systems' compliance with relevant government contracting regulations and identify any potential risks of non-compliance.
301," Examine the financial covenants in CACI International's and Six3 Systems' debt agreements, assessing the potential impact of a merger on their ability to meet these obligations."
302,"Analyze Huntington Ingalls Industries' (HII) and Newport News Shipbuilding's (NNS) financial statements for the past five years, identifying trends in profitability, debt levels, and capital expenditures."
303,"Identify and summarize all significant legal litigations involving HII and NNS in the last decade, detailing outcomes and financial implications."
304,"Evaluate the impact of government contracts on HII and NNS's financial performance and legal compliance, highlighting any significant risks or challenges."
305,Assess the effectiveness of HII and NNS's internal controls over financial reporting based on their SEC filings and auditor reports.
306,Determine the key financial covenants in HII and NNS's debt agreements and assess their compliance with these covenants.
307,Analyze HII and NNS's tax strategies and identify any potential tax risks or liabilities.
308," Summarize the shareholder compensation structures at HII and NNS, including executive compensation and stock-based compensation."
309,Analyze Baker Hughes' legal exposure related to environmental liabilities in their recent annual reports and SEC filings.
310,"Compare the financial performance of General Electric and Baker Hughes over the last five years, highlighting key profitability metrics and identifying significant variances."
311,Assess the impact of recent changes in accounting standards on General Electric's financial statement presentation.
312, Identify any significant legal challenges facing either General Electric or Baker Hughes concerning antitrust or competition issues.
313,Evaluate the effectiveness of General Electric's debt management strategies in light of their recent financial performance.
314,Determine the extent to which Baker Hughes' financial performance is correlated to fluctuations in oil prices.
315, Analyze the financial implications of any joint ventures or partnerships between General Electric and Baker Hughes.
316,Analyze Schlumberger's and Cameron International's financial statements (pre-merger) to identify key financial ratios and metrics that indicate their relative financial health and risk profiles.
317,Detail any legal challenges or antitrust concerns faced by Schlumberger and Cameron International during their merger process.
318," Assess the impact of the Schlumberger-Cameron International merger on the competitive landscape of the oil and gas services industry, referencing relevant legal and financial documentation."
319,"Summarize the terms of the merger agreement between Schlumberger and Cameron International, including the valuation, payment structure, and any contingent considerations."
320, Identify and evaluate any post-merger accounting adjustments or restatements made by Schlumberger related to the acquisition of Cameron International.
321," Analyze the impact of the Schlumberger-Cameron International merger on the credit ratings of the combined entity, citing relevant financial reports and credit rating agency announcements."
322," Determine the extent to which Schlumberger realized the projected synergies from its acquisition of Cameron International, supported by financial performance data and management commentary."
323,"Analyze Halliburton's financial statements for the last five years, identifying trends in profitability, debt levels, and capital expenditures."
324," Summarize any significant legal challenges or lawsuits faced by Halliburton in the past decade, detailing outcomes and financial impacts."
325, Compare and contrast the financial performance of Halliburton and Baker Hughes (prior to termination of their merger)  in the year preceding the proposed merger.
326," Evaluate the disclosed reasons for the termination of the Halliburton-Baker Hughes merger, focusing on the legal and financial aspects."
327, Assess the impact of the failed merger on Halliburton's stock price and investor sentiment.
328, Identify any regulatory hurdles or antitrust concerns that contributed to the termination of the Halliburton-Baker Hughes merger.
329," Examine Halliburton's post-merger-termination restructuring strategies, focusing on their financial and legal implications."
330,Analyze TechnipFMC's post-merger financial statements to identify any material misstatements or inconsistencies.
331," Determine the tax implications of the Technip and FMC merger, including any adjustments or benefits realized."
332,Evaluate the legal challenges faced by TechnipFMC during its integration phase.
333,"Assess the impact of the TechnipFMC merger on shareholder value, considering both short-term and long-term effects."
334,Identify any instances of litigation or regulatory investigations involving TechnipFMC since its formation.
335," Compare TechnipFMC's financial performance pre- and post-merger, highlighting key changes in profitability and efficiency."
336,Summarize the key financial covenants and conditions stipulated in the original merger agreement between Technip and FMC.
337, Assess the impact of significant accounting changes (if any) on CB&I's reported financial performance over the last three years.
338, Determine the extent to which McDermott and CB&I's debt structures impacted their respective credit ratings prior to any merger or acquisition activity.
339," Identify any material legal disputes or litigation involving either McDermott or CB&I in the last decade, detailing their financial implications."
340," Compare and contrast the financial ratios (e.g., profitability, leverage) of McDermott and CB&I before and after any significant corporate restructuring."
341," Evaluate the effectiveness of McDermott's and CB&I's internal controls and risk management frameworks, based on publicly available financial reports and regulatory filings."
342, Analyze the financial implications of any significant asset sales or divestitures undertaken by either McDermott or CB&I in the past five years.
343,"Analyze Fluor's and Stork's financial statements for the past three years to identify key trends in profitability, liquidity, and solvency."
344," Assess the legal and regulatory compliance of Stork's international operations, focusing on potential liabilities related to environmental regulations."
345,Determine the impact of recent changes in accounting standards on Fluor's reported financial performance.
346, Evaluate the potential financial risks associated with Fluor's and Stork's current debt structures.
347, Identify any material legal disputes or litigation involving either Fluor or Stork.
348," Analyze the tax implications of the potential merger between Fluor and Stork, considering both US and international tax laws."
349,Summarize the key financial covenants and restrictions in Fluor's and Stork's outstanding loan agreements.
350,"Analyze Jacobs Engineering Group's and CH2M Hill's financial statements for the past five years, identifying any material weaknesses in internal controls."
351,Summarize any significant legal disputes or litigation involving Jacobs Engineering Group or CH2M Hill in the last decade.
352,Evaluate the tax implications of the CH2M Hill acquisition by Jacobs Engineering Group.
353,"Assess the debt levels and credit ratings of Jacobs Engineering Group post-CH2M Hill acquisition, and project potential refinancing risks."
354,Identify and quantify any potential antitrust concerns arising from the Jacobs Engineering Group and CH2M Hill merger.
355,Determine the impact of the CH2M Hill acquisition on Jacobs Engineering Group's shareholder equity and return on investment.
356, Analyze the contractual agreements and indemnification clauses within the Jacobs Engineering Group and CH2M Hill merger agreement.
357,What were the key financial terms of AECOM's acquisition of URS Corporation?
358,Analyze AECOM's post-merger financial performance compared to URS Corporation's pre-merger performance.
359, Identify any significant legal challenges or lawsuits faced by the combined entity post-merger.
360, Assess the impact of the URS acquisition on AECOM's debt-to-equity ratio and credit rating.
361, Summarize any regulatory filings related to the URS acquisition and its subsequent integration.
362," What were the stated strategic rationales for AECOM's acquisition of URS Corporation, and how did these align with their long-term financial goals?"
363," Evaluate the effectiveness of AECOM's post-merger integration strategy from a legal and financial perspective, highlighting successes and failures."
364," Assess the legal implications of WSP Global's international operations, focusing on compliance with relevant regulations in key markets."
365,Evaluate the effectiveness of WSP Global's risk management strategies as disclosed in their most recent annual report.
366,"Compare the financial performance of WSP Global and Parsons Brinckerhoff prior to their merger, identifying key differences and potential areas of conflict or synergy."
367,Determine the legal structure of the WSP Global/Parsons Brinckerhoff merger and analyze its implications for shareholder rights.
368," Analyze WSP Global's litigation history, identifying significant legal challenges and their financial impact."
369," Assess the tax implications of WSP Global's global operations, focusing on transfer pricing and tax optimization strategies."
370,Analyze Stantec's and MWH Global's financial statements prior to their merger to identify any discrepancies in accounting practices or potential liabilities.
371, Determine the legal structure of the Stantec/MWH Global merger and identify any significant legal challenges or disputes arising from the transaction.
372,Assess the impact of the Stantec/MWH Global merger on the companies' credit ratings and debt obligations.
373," Evaluate the post-merger tax implications for Stantec, considering the integration of MWH Global's assets and liabilities."
374, Identify any antitrust or regulatory concerns raised during or after the Stantec/MWH Global merger approval process.
375," Analyze the financial performance of Stantec post-merger, comparing key metrics to projections and identifying any significant deviations."
376, Examine the litigation history of both Stantec and MWH Global prior to their merger to assess potential legal risks resulting from the combination.
