Index,Queries
1,"Analyze Heinz's and Kraft's financial statements from the past five years to identify trends in profitability, debt levels, and shareholder returns."
2, Detail any significant legal challenges or lawsuits faced by Heinz and Kraft individually in the last decade.
3, Assess the impact of relevant antitrust regulations on a potential Heinz-Kraft merger.
4," Compare the capital structures of Heinz and Kraft, evaluating their respective reliance on debt financing and equity."
5, Identify any material changes in Heinz's or Kraft's accounting policies or practices in the last three years.
6, Evaluate the financial implications of Kraft's divestitures and acquisitions in the past five years.
7, Summarize any significant changes in Heinz's or Kraft's corporate governance structures in the last five years.
8,"Analyze Charter Communications' legal challenges related to its customer service practices in the past five years, quantifying any resulting fines or settlements."
9,Detail the financial impact of Charter Communications' investments in infrastructure upgrades on its profitability and debt levels since its acquisition of Time Warner Cable.
10,"Evaluate the effectiveness of Charter Communications' lobbying efforts regarding telecommunications regulations, focusing on the financial and legal outcomes."
11,Assess the legal ramifications for Charter Communications stemming from any antitrust concerns related to its market dominance in specific geographic areas.
12,"Compare and contrast the financial performance of Charter Communications and Time Warner Cable pre- and post-merger, identifying key drivers of change."
13, Identify and analyze any significant legal disputes involving Charter Communications related to intellectual property rights or licensing agreements.
14, Summarize the key financial covenants and conditions within Charter Com munications' outstanding debt agreements and assess their potential impact on future financial flexibility.
15,Analyze CenturyLink's and Embarq's financial statements to identify any material weaknesses in internal controls over financial reporting.
16,"Summarize all significant legal disputes involving CenturyLink and Embarq in the past five years, outlining the outcomes and financial implications."
17,"Assess the impact of significant accounting changes (e.g., adoption of new accounting standards) on CenturyLink and Embarq's reported financial performance."
18,"Evaluate the effectiveness of CenturyLink and Embarq's debt management strategies, considering their leverage ratios and credit ratings."
19,Determine the extent to which CenturyLink and Embarq comply with relevant telecommunications regulations and the potential financial penalties for non-compliance.
20,Analyze the financial implications of any significant acquisitions or divestitures undertaken by CenturyLink and Embarq in recent years.
21, Prepare a comparative analysis of CenturyLink and Embarq's capital expenditures and their impact on future profitability and cash flow.
22,"What were the key legal challenges faced by Level 3 Communications during its existence, and how were they resolved?"
23,"Analyze Level 3 Communications' financial performance in the years leading up to its acquisition by CenturyLink, identifying key trends and contributing factors."
24, Compare and contrast the financial strategies employed by Level 3 Communications and Global Crossing prior to their respective mergers or acquisitions.
25, Assess the impact of any significant legal settlements or judgments on Global Crossing's financial statements.
26," What were the primary financial drivers behind Global Crossing's bankruptcy filing (if applicable), and what were the subsequent restructuring efforts?"
27, Detail the financial implications of any regulatory fines or penalties levied against either Level 3 Communications or Global Crossing.
28," Examine the debt structures of Level 3 Communications and Global Crossing, highlighting key features and risks associated with each."
29,Analyze Windstream and EarthLink's SEC filings to identify material weaknesses in internal controls over financial reporting.
30," Summarize any significant litigation involving Windstream or EarthLink in the past five years, detailing outcomes and financial implications."
31,"Compare and contrast the debt structures of Windstream and EarthLink, assessing their respective credit ratings and risk profiles."
32, Determine the impact of recent regulatory changes on Windstream and EarthLink's financial performance and future projections.
33, Evaluate the effectiveness of Windstream and EarthLink's strategies for managing their tax liabilities.
34, Assess the financial implications of any significant acquisitions or divestitures undertaken by Windstream or EarthLink in the last decade.
35, Identify key financial ratios for Windstream and EarthLink over the past three years and analyze trends to assess financial health and stability.
36,Analyze Frontier Communications' California litigation history concerning service disruptions and resulting financial penalties.
37, Assess the financial impact of regulatory changes on Verizon's wireline operations in Texas.
38,Determine the extent of Frontier's debt obligations and their potential impact on future profitability in Florida.
39,Evaluate the compliance of Verizon's California wireline operations with federal telecommunications regulations.
40,Quantify the financial performance of Frontier's Texas wireline operations compared to its California and Florida counterparts.
41,Analyze the legal challenges faced by Verizon regarding its wireline infrastructure in Florida.
42," Assess the financial viability of Frontier's wireline business in all three states, considering projected revenue and operating costs."
43,"Analyze Altice's and Cablevision's financial statements to identify key performance indicators (KPIs) pre- and post-merger, focusing on debt levels, profitability, and customer churn."
44," Summarize any significant legal challenges or lawsuits faced by Altice or Cablevision in the past five years, detailing the outcomes and financial implications."
45," Assess the impact of regulatory changes (e.g., FCC rulings) on Altice's and Cablevision's financial performance and business strategies."
46," Compare Altice's and Cablevision's capital expenditure (CAPEX) strategies before and after their merger, analyzing the rationale and impact on their long-term financial health."
47," Evaluate the effectiveness of Altice's and Cablevision's debt management strategies, including their leverage ratios and credit ratings, highlighting any potential risks."
48," Analyze the accounting practices of Altice and Cablevision, focusing on any potential areas of concern regarding revenue recognition or expense reporting."
49," Identify and analyze any significant changes in Altice's or Cablevision's corporate governance structure since the merger, including board composition and executive compensation."
50," Evaluate the legal implications of Dish Network's spectrum holdings and licensing agreements, highlighting any potential disputes or regulatory challenges."
51," Assess the financial performance of EchoStar Corporation relative to its competitors, focusing on profitability, revenue growth, and market share."
52, Determine the impact of recent regulatory changes on Dish Network's financial statements and long-term strategic plans.
53," Analyze EchoStar's historical litigation history, identifying significant legal battles and their financial consequences."
54," Compare and contrast the financial ratios of Dish Network and EchoStar, focusing on liquidity, leverage, and profitability metrics."
55, Evaluate the potential financial consequences for Dish Network of a failure to comply with FCC regulations concerning their satellite services.
56,"Analyze AT&T's financial performance post-acquisition of DirecTV, focusing on Return on Investment (ROI) and identifying any significant accounting adjustments related to the deal."
57," Detail any legal challenges faced by AT&T concerning its ownership and operation of DirecTV, including antitrust concerns or consumer protection lawsuits."
58," Assess the impact of the DirecTV acquisition on AT&T's debt levels and credit ratings, including a timeline of changes and any associated refinancing activities."
59," Compare the projected synergies from the DirecTV merger with the actual results achieved by AT&T, highlighting discrepancies and explaining potential causes."
60," Summarize any regulatory filings made by AT&T regarding its DirecTV operations, focusing on disclosures concerning customer churn rates, service outages, and regulatory compliance."
61," Evaluate the tax implications for AT&T resulting from the DirecTV acquisition, including any adjustments to depreciation, amortization, or tax credits."
62," Analyze the impact of the DirecTV acquisition on AT&T's shareholder value, considering stock price performance and dividend payments in the period following the merger."
63,"Analyze the legal challenges faced by ViacomCBS during its various mergers and separations, focusing on antitrust concerns and shareholder litigation."
64,"Detail Viacom and CBS's financial performance in the five years preceding their initial merger, highlighting key performance indicators (KPIs) and comparing their individual trajectories."
65,Assess the impact of the ViacomCBS merger and subsequent separation on the credit ratings of both entities.
66," Identify all significant acquisitions and divestitures undertaken by Viacom and CBS (separately and jointly) since 2000, providing financial details of each transaction."
67," Compare the capital structures (debt-to-equity ratios, interest expense, etc.) of Viacom and CBS before and after each major corporate restructuring."
68,"Evaluate the tax implications of the Viacom and CBS merger and subsequent separation, focusing on any significant tax liabilities or benefits realized."
69," Compile a list of all regulatory filings (SEC filings, etc.) related to Viacom and CBS's mergers and separations, categorizing them by regulatory body and subject matter."
70,Analyze Lionsgate's debt structure and its impact on future financial flexibility.
71,Evaluate the legal implications of Starz's content licensing agreements.
72,Assess the financial performance of Lionsgate's film studio division compared to its television production arm.
73,Identify any significant legal challenges facing either Lionsgate or Starz in their respective markets.
74,Determine the impact of recent tax law changes on Lionsgate's profitability.
75,"Analyze the financial health of Starz, considering its subscriber base and revenue streams."
76,Compare the financial ratios of Lionsgate and Starz to their industry competitors.
77,"Analyze the tax implications of the Discovery-Scripps merger, including any adjustments for intangible assets and deferred tax liabilities."
78," Detail the financing structure of the Discovery-Scripps merger, specifying debt and equity components, and assess the long-term financial leverage implications."
79, Identify and evaluate any antitrust concerns raised during the regulatory approval process for the Discovery-Scripps merger.
80, Summarize any shareholder lawsuits or litigation arising from the Discovery-Scripps merger and its subsequent effects on share prices.
81," Assess the i   mpact of the Discovery-Scripps merger on the credit ratings of the combined entity, referencing pre- and post-merger ratings."
82," Compare the pre-merger and post-merger financial statements of Discovery and Scripps, highlighting key differences in revenue streams and operating expenses."
83, Determine the accounting treatment used for any asset write-downs or impairments resulting from the Discovery-Scripps merger.
84,"Analyze Tegna's and Standard Media Group's debt structures, identifying potential refinancing risks and opportunities."
85, Determine the tax implications for Tegna and Standard Media Group resulting from a hypothetical merger.
86," Assess the financial performance of Tegna and Standard Media Group over the past five years, highlighting key trends and risks."
87, Compare the legal compliance records of Tegna and Standard Media Group regarding broadcasting regulations.
88,Evaluate the potential antitrust implications of a merger between Tegna and Standard Media Group.
89," Summarize any recent litigation involving either Tegna or Standard Media Group, detailing the outcomes and financial impacts."
90, Analyze the shareholder agreements and ownership structures of both Tegna and Standard Media Group.
91,Analyze the impact of the Nexstar-Tribune merger on debt levels and credit ratings.
92, Assess the antitrust implications of the Nexstar-Tribune merger and subsequent legal challenges.
93, Detail the financial restructuring undertaken by Tribune Media prior to the Nexstar acquisition.
94, Compare the projected and actual financial performance of Nexstar post-acquisition of Tribune Media.
95," Examine the tax implications of the Nexstar-Tribune merger, including any adjustments or liabilities."
96, Identify any shareholder lawsuits or class actions resulting from the Nexstar-Tribune transaction.
97,Evaluate the regulatory approvals required for the Nexstar-Tribune merger and the timeline for their completion.
98,Analyze Gray Television's and Quincy Media's recent SEC filings for any litigation or regulatory actions impacting their financial performance.
99," Determine the debt-to-equity ratios for both Gray Television and Quincy Media over the past five years, and assess their financial leverage."
100,"Compare Gray Television's and Quincy Media's capital expenditure strategies in the last three years, highlighting differences and implications."
101, Evaluate the impact of recent FCC regulations on the profitability of Gray Television and Quincy Media.
102, Assess the potential antitrust implications of a hypothetical merger between Gray Television and Quincy Media in specific geographic markets.
103," Analyze the financial performance of Gray Television and Quincy Media's broadcasting segments, comparing revenue streams and operating margins."
104, Identify any material weaknesses in Gray Television's and Quincy Media's internal controls over financial reporting as disclosed in their most recent audits.
105,Identify any significant legal challenges or lawsuits currently facing Ion Media.
106,Determine the regulatory compliance status of Ion Media concerning broadcasting regulations.
107,Evaluate the legal challenges faced by Meredith Corporation following its acquisition of Time Inc.'s magazine division.
108, Assess the tax implications for Meredith Corporation resulting from the acquisition of Time Inc.'s magazine division.
109, Analyze the financial performance of Time Inc.'s magazine division in the years leading up to the acquisition by Meredith Corporation.
110," Compare the valuation methodologies used by Meredith Corporation in assessing the acquisition target, Time Inc.'s magazine division."
111,Analyze Gannett and GateHouse Media's post-merger financial statements for evidence of cost-cutting measures and their impact on profitability.
112,Identify any legal challenges or antitrust concerns raised regarding the Gannett-GateHouse merger and their ultimate resolution.
113,Assess the impact of the Gannett-GateHouse merger on the debt levels and credit ratings of the combined entity.
114,Summarize any shareholder lawsuits or regulatory investigations resulting from the Gannett-GateHouse merger.
115,Evaluate the changes in Gannett's and GateHouse Media's accounting practices post-merger.
116,Determine the impact of the Gannett-GateHouse merger on employee compensation and benefits.
117, Analyze the tax implications of the Gannett-GateHouse merger for both the combined company and its shareholders.
118,Analyze Vox Media's debt structure and assess its creditworthiness based on its latest financial statements.
119,Identify any significant legal disputes involving Group Nine Media and assess their potential financial impact.
120, Evaluate the tax implications of a hypothetical acquisition of Vox Media by Group Nine Media.
121,Determine the impact of recent regulatory changes on Group Nine Media's advertising revenue streams.
122,"Compare the financial performance of Vox Media and Group Nine Media over the past three years, highlighting key differences."
123, Assess the financial viability of a joint venture between Vox Media and Group Nine Media in the podcasting sector.
124, Analyze the intellectual property rights held by both Vox Media and Group Nine Media and identify any potential legal conflicts.
125,"Analyze BuzzFeed and Complex Media's debt structures, highlighting potential refinancing risks and opportunities."
126,Assess the impact of recent interest rate hikes on BuzzFeed and Complex Media's financial performance and future projections.
127,Evaluate the legal implications of any intellectual property disputes involving BuzzFeed and Complex Media.
128,Determine the tax liabilities and strategies employed by BuzzFeed and Complex Media in their most recent fiscal year.
129, Compare the financial ratios and profitability of BuzzFeed and Complex Media to their industry competitors.
130, Identify potential antitrust concerns related to a hypothetical merger between BuzzFeed and Complex Media.
131,Examine the shareholder agreements and governance structures of BuzzFeed and Complex Media.
132, Assess the legal ramifications for Politico resulting from recent changes in EU media regulations.
133, Evaluate the financial impact of Axel Springer's digital transformation strategy on its revenue streams and profitability.
134,Determine the potential antitrust concerns arising from a hypothetical acquisition of a competitor by Axel Springer.
135, Analyze Politico's revenue diversification strategy and its effectiveness in mitigating financial risks.
136," Examine the legal compliance of both Axel Springer and Politico regarding data privacy regulations (GDPR, CCPA etc.)."
137," Compare the financial performance metrics (e.g., operating margins, return on equity) of Axel Springer and Politico over the last three years."
138,Analyze IAC's and Dotdash's financial statements to identify potential accounting irregularities or inconsistencies over the past five years.
139, Assess the legal implications of any significant acquisitions or divestitures undertaken by IAC or Dotdash in the last decade.
140, Determine the impact of recent changes in tax laws on the financial performance of IAC and Dotdash.
141, Evaluate the effectiveness of IAC's and Dotdash's internal controls in preventing and detecting financial fraud.
142," Compare the debt structures of IAC and Dotdash, highlighting potential risks associated with high leverage."
143," Examine the shareholder litigation history of IAC and Dotdash, focusing on the nature of claims and outcomes."
144, Analyze the compliance of IAC and Dotdash with securities regulations related to financial reporting and transparency.
145,"Analyze Zillow Group's and Trulia's financial statements for the past five years, identifying trends in revenue, profitability, and debt levels."
146," Assess the legal implications of Zillow Group's iBuying program, focusing on potential regulatory challenges and litigation risks."
147,Evaluate the impact of recent changes in real estate market regulations on Zillow Group's and Trulia's financial performance.
148,Summarize any significant legal settlements or lawsuits involving Zillow Group or Trulia in the last decade.
149,"Compare and contrast the capital structures of Zillow Group and Trulia, highlighting any significant differences in debt levels, equity financing, or risk profiles."
150,"Analyze the tax implications of Zillow Group's and Trulia's business models, including any potential tax liabilities or optimization strategies."
151, Assess the financial and legal risks associated with Zillow Group's and Trulia's reliance on third-party data providers.
152,Analyze Redfin's and RentPath's financial statements to identify key differences in their revenue streams and cost structures.
153, Assess the legal compliance of Redfin's and RentPath's data handling practices concerning consumer privacy regulations.
154, Compare the debt-to-equity ratios of Redfin and RentPath over the past five years and analyze the implications for their financial stability.
155, Evaluate the potential antitrust implications of a hypothetical merger between Redfin and RentPath.
156, Summarize any significant legal disputes or litigation involving either Redfin or RentPath in the last three years.
157, Analyze the tax implications for investors resulting from Redfin's and RentPath's respective business models.
158, Identify and compare Redfin and RentPath's key financial risk factors as disclosed in their most recent 10-K filings.
159,Analyze CoStar Group's and LoopNet's financial statements to identify potential areas of legal and financial risk associated with their overlapping business operations.
160,"Summarize any legal challenges or lawsuits faced by either CoStar Group or LoopNet in the past five years, detailing their outcomes and financial implications."
161,"Evaluate the tax implications of a potential merger between CoStar Group and LoopNet, considering potential deductions, credits, and liabilities."
162,"Compare and contrast the financial performance of CoStar Group and LoopNet over the past decade, highlighting key metrics and identifying periods of significant growth or decline."
163," Assess the compliance of CoStar Group and LoopNet with relevant securities laws and regulations, noting any instances of non-compliance or potential violations."
164," Examine the debt structures of CoStar Group and LoopNet, identifying potential risks associated with high levels of leverage or unfavorable debt covenants."
165, Analyze the potential impact of a significant economic downturn on the financial stability and legal standing of both CoStar Group and LoopNet.
166,"Analyze Expedia and Orbitz's historical financial statements to identify trends in revenue streams, profitability, and debt levels prior to their merger."
167," Assess the legal challenges faced by Expedia and Orbitz during their merger process, including antitrust concerns and regulatory approvals."
168,"Determine the post-merger financial performance of the combined Expedia and Orbitz entity, focusing on key performance indicators (KPIs) and shareholder returns."
169,Evaluate the impact of accounting standards changes on Expedia and Orbitz's financial reporting after their integration.
170," Identify any significant litigation or legal disputes involving Expedia or Orbitz post-merger, detailing their financial implications."
171,"Analyze the tax implications of the Expedia and Orbitz merger, including any adjustments made to reported financial results."
172, Summarize the financial restructuring initiatives undertaken by Expedia and Orbitz following their merger and assess their effectiveness.
173," Assess the financial implications of Kayak's integration into Booking Holdings, including acquisition costs, resulting operational efficiencies, and changes in market share."
174, Identify and evaluate any material changes in Booking Holdings' tax liabilities following major acquisitions or changes in tax legislation.
175, Examine Booking Holdings’ disclosures regarding potential regulatory risks related to data privacy and consumer protection laws.
176,Summarize any significant legal settlements or judgments involving Booking Holdings or Kayak and their financial consequences.
177,Analyze TripAdvisor's and Viator's financial statements to identify potential conflicts of interest arising from their business relationship.
178, Assess the legal implications of TripAdvisor's data usage concerning user reviews and their impact on Viator's business.
179,Determine the tax implications of Viator's operations in different jurisdictions and their potential impact on TripAdvisor's consolidated financial statements.
180,"Evaluate the financial performance of Viator since its acquisition by TripAdvisor, highlighting key performance indicators and return on investment."
181, Analyze TripAdvisor's and Viator's compliance with consumer protection laws regarding online travel bookings and tour services.
182, Assess the potential antitrust implications of TripAdvisor's relationship with Viator concerning market dominance in the online travel sector.
183," Quantify the financial impact of any potential litigation or regulatory actions on TripAdvisor and Viator, separately and together."
184,Analyze Booking Holdings' financial statements for the past five years to identify trends in revenue streams from OpenTable and assess their overall contribution to Booking Holdings' profitability.
185," Assess the legal implications of Booking Holdings' acquisition of OpenTable, focusing on antitrust concerns and regulatory scrutiny."
186, Identify any significant legal disputes or litigation involving Booking Holdings related to OpenTable's operations.
187,Evaluate the impact of OpenTable's business model on Booking Holdings' overall financial risk profile.
188," Determine the extent to which Booking Holdings' accounting practices related to OpenTable comply with relevant accounting standards (e.g., GAAP)."
189,Analyze Booking Holdings' disclosures regarding the financial performance and strategic importance of OpenTable in their SEC filings.
190," Compare the financial performance of OpenTable before and after its acquisition by Booking Holdings, highlighting key performance indicators."
