Index,Queries
377,Analyze Tetra Tech's and Coffey International's financial statements to identify potential areas of legal and financial risk associated with their international operations.
378," Determine the historical litigation history of Tetra Tech and Coffey International,  categorizing cases by type and outcome, and assessing potential future liabilities."
379,"Compare and contrast the corporate governance structures of Tetra Tech and Coffey International, highlighting any potential conflicts of interest or areas of weakness."
380,Evaluate the tax implications for both Tetra Tech and Coffey International resulting from past acquisitions and mergers.
381,"Assess the compliance of Tetra Tech and Coffey International with relevant environmental regulations,  quantifying potential fines or penalties."
382,"Analyze Tetra Tech and Coffey International's debt structure, including the terms and conditions of their loans and the potential impact on their financial health."
383, Summarize any significant changes in accounting policies or practices employed by Tetra Tech and Coffey International in their recent financial reporting.
384,"Analyze Wood plc's financial statements for the last three years, identifying key trends in profitability, liquidity, and solvency."
385, Assess the legal implications of Amec Foster Wheeler's past acquisitions on its current financial reporting.
386, Compare and contrast the debt structures of Wood and Amec Foster Wheeler before their merger.
387,Determine the impact of significant accounting changes on Wood's financial performance over the past five years.
388,Evaluate the effectiveness of Wood's internal controls regarding financial reporting compliance.
389,Identify any material litigation or regulatory actions impacting Amec Foster Wheeler's financial position.
390, Analyze the tax implications of cross-border transactions undertaken by Wood plc.
391,"Analyze WorleyParsons' and Jacobs' financial statements for the past three years to identify trends in profitability, debt levels, and cash flow."
392,Identify and assess the material legal risks faced by WorleyParsons and Jacobs concerning environmental regulations and compliance.
393,"Compare and contrast WorleyParsons' and Jacobs' accounting policies and practices, highlighting any significant differences."
394,Evaluate the potential impact of recent legal judgments on the financial performance and stability of either WorleyParsons or Jacobs.
395, Determine the extent of WorleyParsons' and Jacobs' exposure to foreign exchange risk and their strategies for mitigating such risk.
396," Analyze the debt structure of WorleyParsons and Jacobs, including the terms and conditions of their outstanding loans and bonds."
397, Assess the compliance of WorleyParsons and Jacobs with relevant securities laws and regulations regarding financial reporting and disclosure.
398,"Analyze KBR's and Wyle's historical litigation history, identifying key legal challenges and their financial outcomes."
399,"Compare and contrast KBR and Wyle's financial ratios (e.g., profitability, liquidity, leverage) over the past five years."
400, Assess the compliance risk for KBR and Wyle related to government contracting regulations.
401,Evaluate the impact of recent accounting standards changes on KBR and Wyle's financial reporting.
402, Determine the potential financial implications of a hypothetical acquisition of Wyle by KBR.
403, Analyze KBR and Wyle's tax strategies and their potential exposure to tax audits.
404, Identify and assess material financial risks disclosed in KBR and Wyle's most recent SEC filings.
405,"Analyze Danaher's financial statements for the last five years, identifying trends in profitability, debt levels, and capital expenditures."
406," Assess Pall Corporation's legal compliance history, focusing on environmental regulations and product liability lawsuits."
407, Compare the financial performance of Danaher and Pall Corporation prior to any potential merger or acquisition.
408, Evaluate the potential antitrust implications of a hypothetical Danaher acquisition of Pall Corporation.
409, Determine the impact of recent tax law changes on the financial reporting of both Danaher and Pall Corporation.
410, Analyze Danaher's and Pall Corporation's  disclosure practices regarding executive compensation and related-party transactions.
411,Identify any material weaknesses in the internal controls over financial reporting reported by either Danaher or Pall Corporation.
412,"Analyze Thermo Fisher Scientific's litigation history, identifying key cases and their financial implications."
413,Assess the impact of recent tax law changes on Life Technologies' financial statements.
414, Compare the debt-to-equity ratios of Thermo Fisher Scientific and Life Technologies over the past five years.
415, Evaluate the effectiveness of Thermo Fisher Scientific's internal controls over financial reporting.
416, Determine the potential antitrust implications of a hypothetical merger between Thermo Fisher Scientific and another major competitor.
417, Summarize Life Technologies' compliance with Sarbanes-Oxley Act regulations.
418, Analyze Thermo Fisher Scientific's investment portfolio and its impact on overall financial performance.
419,"Analyze PerkinElmer's and Euroimmun's financial statements for the last five years to identify trends in revenue, profitability, and debt levels."
420, Assess the legal compliance of PerkinElmer and Euroimmun regarding anti-trust regulations in their respective markets.
421, Evaluate the potential legal and financial risks associated with a hypothetical acquisition of Euroimmun by PerkinElmer.
422, Compare and contrast the financial ratios of PerkinElmer and Euroimmun to benchmark their performance against industry peers.
423," Examine the intellectual property portfolios of PerkinElmer and Euroimmun, assessing their financial value and potential legal vulnerabilities."
424, Identify any significant legal disputes or litigation involving either PerkinElmer or Euroimmun in the past decade and assess their financial impact.
425," Analyze the tax implications for a potential merger or acquisition between PerkinElmer and Euroimmun, considering both companies' global operations."
426,"What were the key financial terms of Agilent's acquisition of Varian, including purchase price and financing methods?"
427,"Analyze Agilent's post-acquisition integration strategy for Varian, focusing on cost reduction measures and their financial impact."
428, Identify any significant legal challenges or lawsuits faced by Agilent related to the Varian acquisition or subsequent business operations.
429," Compare the financial performance of Varian before and after the Agilent acquisition, focusing on key metrics like revenue, profit margins, and return on assets."
430, Assess the impact of the Varian acquisition on Agilent's debt levels and credit ratings.
431," Summarize any regulatory filings or disclosures made by Agilent concerning the Varian acquisition, including antitrust reviews or other relevant approvals."
432, Evaluate the long-term financial impact of the Varian acquisition on Agilent's shareholder value.
433,"Analyze Waters Corporation's and TA Instruments' financial statements for the past five years to identify trends in revenue, profitability, and debt levels."
434, Summarize any significant legal actions or regulatory investigations involving Waters Corporation or TA Instruments in the last decade.
435, Compare the financial performance of Waters Corporation and TA Instruments against their major competitors.
436, Identify and assess the key financial risks facing Waters Corporation and TA Instruments in the next three years.
437, Evaluate the effectiveness of Waters Corporation's and TA Instruments' corporate governance structures.
438, Determine the impact of recent tax law changes on Waters Corporation and TA Instruments' financial statements.
439, Analyze Waters Corporation's and TA Instruments' capital expenditure plans and their implications for future growth.
440,Analyze Mettler Toledo's and Sartorius Mechatronics' recent SEC filings for potential accounting irregularities or inconsistencies.
441,"Compare and contrast the debt structures of Mettler Toledo and Sartorius Mechatronics, identifying potential risks associated with their respective leverage ratios."
442,Assess the litigation risk profiles of Mettler Toledo and Sartorius Mechatronics based on publicly available information.
443,Evaluate the tax implications of a hypothetical merger between Mettler Toledo and Sartorius Mechatronics.
444,Determine the impact of recent regulatory changes on the financial performance of Mettler Toledo and Sartorius Mechatronics.
445,Analyze the shareholder agreements and ownership structures of Mettler Toledo and Sartorius Mechatronics.
446," Compare the historical financial performance of Mettler Toledo and Sartorius Mechatronics, focusing on profitability, revenue growth, and return on equity."
447,"Analyze Cardinal Health's legal exposure related to opioid litigation, detailing the financial impact of settled and ongoing cases."
448," Assess the financial performance of Cordis Corporation since its acquisition by Cardinal Health, highlighting key performance indicators (KPIs) and comparing them to pre-acquisition performance."
449," Determine the impact of recent healthcare regulations on Cardinal Health's financial statements, specifying affected revenue streams and compliance costs."
450," Evaluate the effectiveness of Cardinal Health's internal controls and risk management frameworks, citing instances of financial reporting irregularities or compliance violations."
451," Compare the debt structures of Cardinal Health and Cordis Corporation before and after the acquisition, analyzing changes in credit ratings and interest expense."
452," Identify any significant legal challenges faced by Cordis Corporation prior to its acquisition by Cardinal Health, and their subsequent resolution or ongoing impact."
453,"Analyze Cardinal Health's tax strategies and their implications on the company's overall financial performance, focusing on any potential legal challenges or risks."
454,Analyze Medtronic's financial statements post-Covidien acquisition to identify any impairment charges related to goodwill or intangible assets.
455," What legal challenges did Medtronic face in the period surrounding its acquisition of Covidien, and what were the outcomes?"
456," Detail the tax implications for Medtronic resulting from its acquisition of Covidien, including any restructuring or tax avoidance strategies employed."
457, Compare Medtronic's debt-to-equity ratio before and after the Covidien acquisition and discuss any changes in credit rating.
458, Identify any class-action lawsuits filed against Medtronic related to its products or business practices following the Covidien merger.
459, Assess the impact of the Covidien acquisition on Medtronic's regulatory compliance and reporting requirements.
460, What were the key financial covenants and conditions stipulated in the Medtronic-Covidien merger agreement?
461,"Analyze Zimmer Biomet's historical financial statements to identify trends in profitability, revenue growth, and debt levels."
462," Summarize all significant legal actions involving Zimmer Biomet in the last five years, including outcomes and financial implications."
463, Compare and contrast the financial performance of Zimmer Biomet and Biomet (pre-merger) to assess the rationale for the merger.
464, Evaluate Zimmer Biomet's current debt structure and its implications for long-term financial health.
465, Identify any material changes in Zimmer Biomet's accounting policies or practices over the past decade and their impact on reported financials.
466," Assess the regulatory compliance of Zimmer Biomet's product lines, highlighting any significant penalties or warnings received."
467, Determine the impact of intellectual property litigation on Zimmer Biomet's financial performance and market position.
468,"Analyze Stryker's and Wright Medical's historical litigation history, identifying key legal battles and their financial impact."
469,Compare and contrast Stryker's and Wright Medical's financial reporting practices regarding revenue recognition and impairment charges.
470," Assess the tax implications for Stryker resulting from its past acquisitions, particularly those involving Wright Medical."
471,Determine the level of debt financing used by Stryker and Wright Medical in their most recent major acquisitions.
472,Evaluate the impact of recent regulatory changes on Stryker's and Wright Medical's financial performance and future projections.
473, Analyze the shareholder activism and litigation involving Stryker and Wright Medical in the last five years.
474," Compare the financial ratios (e.g., profitability, liquidity, solvency) of Stryker and Wright Medical over the past decade."
475,Analyze Smith & Nephew's recent SEC filings to identify any material weaknesses in internal controls over financial reporting.
476, Assess the litigation risk faced by Osiris Therapeutics based on publicly available legal documents and news reports.
477,Quantify the impact of changes in healthcare regulations on Smith & Nephew's profitability over the last five years.
478," Compare and contrast the debt structures of Smith & Nephew and Osiris Therapeutics, evaluating their respective creditworthiness."
479, Evaluate the effectiveness of Smith & Nephew's tax planning strategies based on their financial statements and tax filings.
480, Identify any significant accounting changes implemented by Osiris Therapeutics in recent years and assess their impact on reported financial performance.
481, Determine the key financial covenants in any significant loan agreements held by either Smith & Nephew or Osiris Therapeutics.
482,"Analyze Boston Scientific's SEC filings (10-K, 10-Q) from the last three years to identify trends in litigation expenses and associated legal risks."
483," Compare and contrast the debt structures of Boston Scientific and BTG, assessing their respective credit ratings and potential vulnerabilities to interest rate changes."
484," What are the key tax implications for Boston Scientific resulting from its international operations, based on its most recent annual report?"
485,Identify any significant changes in Boston Scientific's accounting policies in the last five years and assess the impact on reported financial performance.
486," Evaluate the financial performance of BTG's key product lines in the last two years, highlighting any segments experiencing significant revenue decline or margin compression."
487, Examine any antitrust concerns or regulatory challenges faced by Boston Scientific or BTG in the past decade.
488,"Summarize any major acquisitions or divestitures undertaken by either Boston Scientific or BTG in the past five years, evaluating the stated financial rationale and actual outcomes."
489,"Analyze Hologic's and Gen-Probe's financial statements for the past five years to identify trends in revenue, profitability, and debt levels."
490,Summarize any significant legal disputes or regulatory investigations involving Hologic and Gen-Probe in the past decade.
491,Evaluate the impact of key acquisitions on Hologic's and Gen-Probe's financial performance and market position.
492,Identify any material changes in Hologic's and Gen-Probe's accounting policies or practices in recent years.
493,Compare Hologic's and Gen-Probe's corporate governance structures and risk management practices.
494,Assess the potential financial implications of changes in healthcare regulations on Hologic and Gen-Probe.
495, Analyze Hologic's and Gen-Probe's tax strategies and their potential exposure to tax audits or penalties.
496,"Analyze Roche's and Genentech's financial statements for the past five years, identifying any significant trends in revenue, profitability, and debt levels."
497, Assess the legal implications of Genentech's operating structure as a subsidiary of Roche.
498, Evaluate potential antitrust concerns related to Roche's acquisition of Genentech and subsequent market dominance.
499, Quantify the financial impact of any significant litigation involving Roche or Genentech in the last decade.
500," Compare the financial performance of Roche and Genentech before and after the acquisition, focusing on key performance indicators."
501," Examine Roche's and Genentech's compliance with relevant pharmaceutical regulations (e.g., FDA, EMA) in the last three years."
502," Determine the tax implications for Roche resulting from its ownership of Genentech, including transfer pricing strategies and tax avoidance allegations."
503,Analyze Amgen's and Onyx Pharmaceuticals' financial statements to identify potential antitrust concerns related to a hypothetical merger.
504, Detail the legal ramifications of a potential intellectual property infringement lawsuit between Amgen and Onyx Pharmaceuticals.
505,"Assess the financial impact of a potential drug price increase on Amgen's profitability, considering potential legal challenges and market reactions."
506," Examine the tax implications for Amgen resulting from a hypothetical acquisition of Onyx Pharmaceuticals, considering both US and international tax laws."
507," Compare and contrast the financial risk profiles of Amgen and Onyx Pharmaceuticals, based on their latest SEC filings."
508, Evaluate the legal compliance of Amgen and Onyx Pharmaceuticals' clinical trial data reporting practices.
509," Summarize any significant legal settlements or judgments involving either Amgen or Onyx Pharmaceuticals in the past five years, and their financial impact."
510,"Analyze Gilead Sciences' financial statements post-Pharmasset acquisition to identify the impact on revenue, profitability, and debt levels."
511,Detail any legal challenges or lawsuits faced by Gilead Sciences related to its Pharmasset acquisition or the subsequent marketing of acquired drugs.
512,"Assess the financial performance of Pharmasset prior to its acquisition by Gilead Sciences, highlighting key financial metrics and trends."
513,"Summarize the terms of the Gilead Sciences-Pharmasset merger agreement, including purchase price, payment structure, and any contingencies."
514,Identify any significant accounting adjustments or restatements made by Gilead Sciences related to its Pharmasset acquisition.
515,"Evaluate the tax implications for Gilead Sciences resulting from the Pharmasset acquisition, including any tax benefits or liabilities."
516,Examine Gilead Sciences' disclosures regarding intangible assets acquired through the Pharmasset deal and their subsequent amortization or impairment.
517,What were the key financial terms of Celgene's acquisition of Juno Therapeutics?
518," Analyze Celgene's financial reporting related to its Juno Therapeutics investment, highlighting any impairments or write-downs."
519, Identify any legal challenges or lawsuits faced by Celgene resulting from the Juno Therapeutics acquisition.
520," What was the impact of the Juno Therapeutics acquisition on Celgene's overall financial performance (e.g., revenue, profitability, debt)?"
521," Summarize the regulatory filings related to Celgene's acquisition of Juno Therapeutics, focusing on antitrust concerns."
522, Assess the post-acquisition integration challenges faced by Celgene regarding Juno Therapeutics' operations and intellectual property.
523, What were the long-term financial implications for Celgene stemming from its investment in and subsequent actions related to Juno Therapeutics?
524,"Analyze Bristol Myers Squibb's and Celgene's financial statements post-merger to identify any material changes in revenue streams, profitability, and debt levels."
525," Assess the legal challenges faced by Bristol Myers Squibb and Celgene since their merger, focusing on antitrust concerns and patent litigation."
526, Identify key provisions in the Bristol Myers Squibb-Celgene merger agreement regarding intellectual property rights and future drug development.
527," Evaluate the impact of the Bristol Myers Squibb-Celgene merger on shareholder value, comparing pre- and post-merger stock performance and dividend payouts."
528," Summarize any significant legal settlements or judgments involving Bristol Myers Squibb or Celgene since their merger, detailing financial penalties and reputational impact."
529, Analyze the financial impact of key drug approvals and failures on Bristol Myers Squibb post-Celgene acquisition.
530," Determine the extent to which the Bristol Myers Squibb-Celgene merger altered the company's regulatory compliance posture, focusing on any changes in fines or sanctions."
531,Analyze Takeda's financial statements post-Shire acquisition to identify any impairment charges related to goodwill or intangible assets.
532, Identify and summarize all significant litigation involving Takeda or Shire since their merger.
533,"Determine the tax implications for Takeda resulting from the Shire acquisition, including any adjustments to deferred tax assets or liabilities."
534, Assess the impact of the Takeda-Shire merger on Takeda's credit rating and debt covenants.
535,Evaluate the effectiveness of Takeda's post-merger integration strategy concerning Shire's R&D pipeline.
536, Compile a list of all regulatory approvals required for the Takeda-Shire merger and assess any associated penalties or delays.
537,"Analyze the shareholder agreements and voting rights related to the Takeda-Shire merger, highlighting any significant changes in ownership structure."
538,Analyze AstraZeneca's and Alexion's financial statements to identify any potential conflicts of interest arising from overlapping business activities or investments.
539,"Detail any significant legal challenges or lawsuits faced by AstraZeneca or Alexion in the past five years, including outcomes and financial implications."
540,"Assess the tax implications for AstraZeneca resulting from its acquisition of Alexion, considering both short-term and long-term effects."
541,"Compare the debt-to-equity ratios of AstraZeneca and Alexion before and after the acquisition, and analyze the impact on their credit ratings."
542,"Summarize the key provisions of the merger agreement between AstraZeneca and Alexion, focusing on payment terms, regulatory approvals, and conditions precedent."
543,Evaluate the impact of any ongoing or anticipated legal proceedings on AstraZeneca's and Alexion's financial performance and future prospects.
544,Identify and analyze any material changes to AstraZeneca's financial reporting practices following the acquisition of Alexion.
545,Analyze Pfizer's and Arena Pharmaceuticals' recent SEC filings to identify any material weaknesses in their internal controls over financial reporting.
546," Assess the potential legal challenges facing Pfizer's acquisition of Arena Pharmaceuticals, focusing on antitrust concerns and regulatory approvals."
547, Quantify the financial impact of Arena Pharmaceuticals' product pipeline on Pfizer's projected revenue and earnings per share over the next five years.
548, Compare the debt levels and credit ratings of Pfizer and Arena Pharmaceuticals before and after the proposed merger.
549," Summarize the key terms and conditions of the merger agreement between Pfizer and Arena Pharmaceuticals, including payment structure and deal contingencies."
550," Evaluate the potential tax implications of the Pfizer-Arena Pharmaceuticals merger for both companies, considering any potential adjustments to their tax liabilities."
551, Identify any significant litigation or legal disputes involving either Pfizer or Arena Pharmaceuticals that could impact the success of their merger.
552,What were the key financial terms of Merck's acquisition of Acceleron Pharma?
553,Analyze the impact of the Acceleron Pharma acquisition on Merck's financial statements.
554,Identify any legal challenges or regulatory hurdles faced during the Merck-Acceleron Pharma merger.
555,Assess the post-merger integration strategy employed by Merck regarding Acceleron Pharma's operations.
556,What were the projected and actual synergies realized from the Merck-Acceleron Pharma deal?
557, Summarize any shareholder litigation or disputes arising from the Merck-Acceleron Pharma acquisition.
558, Evaluate the long-term financial performance of the combined entity (Merck post-acquisition of Acceleron Pharma) compared to pre-acquisition projections.
559,Analyze Eli Lilly's and Loxo Oncology's financial statements (pre and post-acquisition) to identify the impact of the acquisition on Eli Lilly's overall financial performance.
560,"Detail the legal structure of the Loxo Oncology acquisition by Eli Lilly, including the acquisition price, payment methods, and any contingent payments."
561, Identify all significant legal challenges or lawsuits faced by Eli Lilly related to the Loxo Oncology acquisition or its subsequent operations.
562, Compare Eli Lilly's and Loxo Oncology's pre-merger and post-merger tax liabilities and strategies.
563, Assess the impact of the Loxo Oncology acquisition on Eli Lilly’s debt-to-equity ratio and credit rating.
564, Summarize the regulatory approvals required for the Loxo Oncology acquisition and any subsequent regulatory actions impacting the combined entity.
565," Evaluate the potential antitrust implications of Eli Lilly's acquisition of Loxo Oncology, and any related legal actions or investigations."
566,"What were the key legal challenges faced by Novartis and The Medicines Company during their collaborations, and how were they resolved?"
