Index,Queries
757,"Evaluate the financial performance of Microsoft's cloud computing division compared to its competitors, identifying key strengths and weaknesses."
758, Summarize the legal challenges faced by LinkedIn regarding user data and intellectual property rights.
759, Analyze Microsoft's tax strategies and their impact on its overall financial performance.
760, Determine the financial impact of any recent acquisitions or divestitures undertaken by either Microsoft or LinkedIn.
761," Assess the legal risks associated with Microsoft's and LinkedIn's global operations, considering antitrust regulations and data protection laws in various jurisdictions."
762,"Analyze Microsoft's legal battles related to antitrust concerns since 2010, outlining the outcomes and financial implications of each case."
763," Assess the financial impact of Skype's integration into Microsoft, detailing revenue streams, cost reductions, and return on investment."
764," Evaluate the tax implications for Microsoft resulting from its acquisition of Skype, including any adjustments or penalties incurred."
765, Compare Microsoft's and Skype's pre-merger financial statements to identify potential conflicts of interest or areas of overlapping liabilities.
766," Determine the legal compliance of Microsoft's data handling practices concerning Skype user data, identifying any potential violations or risks."
767," Analyze the financial performance of Skype as a standalone entity before and after its acquisition by Microsoft, comparing key performance indicators."
768," Outline the legal framework governing Microsoft's ownership and operation of Skype, highlighting any significant regulatory hurdles or limitations."
769,Analyze Apple's financial statements to determine the impact of Beats Electronics acquisition on Apple's overall profitability and return on investment.
770,Identify any legal challenges or antitrust concerns Apple faced during or after the acquisition of Beats Electronics.
771,Evaluate the intellectual property portfolio implications of the Beats Electronics acquisition for Apple.
772,"Assess the accounting treatment of the Beats Electronics acquisition in Apple's financial records, focusing on goodwill and intangible assets."
773,Determine the tax implications of the Beats Electronics acquisition for both Apple and Beats Electronics.
774, Examine any shareholder lawsuits or regulatory investigations related to the Beats Electronics acquisition.
775,Compare the financial performance of Beats Electronics as a standalone entity versus its performance as a subsidiary of Apple.
776,"Analyze Oracle's legal battles concerning intellectual property rights from 2000-2010, detailing the outcomes and financial implications."
777," Assess the impact of Sun Microsystems' acquisition by Oracle on Oracle's subsequent financial performance, focusing on revenue streams and operating expenses."
778, Detail the financial restructuring undertaken by Sun Microsystems in the years leading up to its acquisition by Oracle.
779, Evaluate the legal challenges Oracle faced regarding antitrust concerns post-Sun acquisition.
780, Summarize the financial reporting irregularities (if any) discovered during audits of Sun Microsystems prior to its acquisition.
781," Analyze the tax implications for Oracle resulting from the Sun Microsystems acquisition, including any tax liabilities or benefits."
782," Compare and contrast the financial ratios (e.g., debt-to-equity, profitability margins) of Oracle before and after the Sun Microsystems acquisition."
783,Analyze Salesforce's legal compliance with GDPR concerning Slack user data post-acquisition.
784, Assess the financial impact of Slack's integration into Salesforce's overall product suite.
785,"Determine the tax implications of Salesforce's acquisition of Slack, including any adjustments to reported earnings."
786, Evaluate the potential antitrust concerns arising from the Salesforce-Slack merger.
787, Summarize the financial performance of Slack since its acquisition by Salesforce.
788, Identify any legal challenges Salesforce faced related to the Slack acquisition and their resolutions.
789,Analyze Salesforce's financial reporting related to goodwill impairment following the Slack acquisition.
790,Analyze Adobe's and Figma's financial statements to identify potential antitrust concerns arising from their merger.
791,"Summarize the legal challenges faced by Adobe in the past five years, focusing on intellectual property disputes."
792,"Detail the financial implications of Figma's acquisition for Adobe, including acquisition cost, projected ROI, and amortization schedules."
793,"Assess the tax implications of the Adobe-Figma merger for both companies, considering international tax laws and regulations."
794,Compare and contrast the legal structures of Adobe and Figma prior to their merger.
795,"Identify any potential conflicts of interest arising from the Adobe-Figma merger, and suggest mitigation strategies."
796,Evaluate the compliance of Adobe and Figma with relevant data privacy regulations following their merger.
797,Analyze IBM's and Red Hat's financial statements to identify potential antitrust concerns related to their merger.
798," Determine the tax implications for IBM resulting from the Red Hat acquisition, detailing any adjustments or benefits claimed."
799, Assess the legal challenges faced by IBM in integrating Red Hat's open-source business model into its existing structure.
800," Evaluate the impact of the Red Hat acquisition on IBM's shareholder value, citing specific financial metrics and legal considerations."
801," Summarize any significant litigation involving IBM and Red Hat post-merger, outlining the nature of the claims and outcomes."
802," Compare IBM's financial performance before and after the Red Hat acquisition, highlighting key changes and attributing them to specific legal or financial factors."
803, Analyze Red Hat's intellectual property portfolio and assess its legal protection and contribution to IBM's overall financial performance.
804,Analyze Avago Technologies' and Broadcom's financial statements (pre-merger) to identify key financial ratios and metrics indicating their respective financial health and risk profiles.
805,"Detail the legal and regulatory approvals required for the Avago Technologies-Broadcom merger, including timelines and potential challenges encountered."
806,"Assess the post-merger integration challenges faced by Broadcom following its acquisition of Avago Technologies, focusing on financial restructuring and legal compliance."
807," Quantify the impact of the Avago Technologies acquisition on Broadcom's overall financial performance, including revenue growth, profitability, and shareholder returns."
808,"Evaluate any litigation or legal disputes involving Avago Technologies or Broadcom prior to and after their merger, outlining the outcomes and financial implications."
809,"Compare and contrast the accounting practices employed by Avago Technologies and Broadcom before their merger, highlighting any potential areas of inconsistency or risk."
810,"Identify and analyze any material changes in Broadcom's financial reporting following its acquisition of Avago Technologies, focusing on the treatment of goodwill and intangible assets."
811,Analyze Broadcom's and CA Technologies' financial statements to identify any material weaknesses in internal controls over financial reporting post-merger.
812,"Summarize all significant litigation involving Broadcom and CA Technologies since their merger, detailing the outcomes and financial implications."
813,"Evaluate the tax implications of Broadcom's acquisition of CA Technologies, including any adjustments made to previously filed tax returns."
814,Assess the impact of Broadcom's acquisition of CA Technologies on the credit ratings of both companies.
815,Determine the extent to which Broadcom's acquisition of CA Technologies complied with all relevant antitrust regulations.
816,"Analyze the financial performance of CA Technologies as a standalone entity prior to its acquisition by Broadcom, focusing on key financial ratios and trends."
817,Identify and quantify any impairment charges recognized by Broadcom related to intangible assets acquired from CA Technologies.
818,Analyze CVS Health's and Aetna's financial statements to identify potential antitrust concerns arising from their merger.
819, Detail the legal challenges faced by CVS Health and Aetna post-merger related to healthcare pricing and reimbursement.
820, Assess the impact of healthcare regulations on CVS Health's and Aetna's profitability since their merger.
821," Compare and contrast CVS Health's and Aetna's pre- and post-merger financial performance metrics, focusing on key profitability indicators."
822," Examine the legal documentation surrounding the CVS Health-Aetna merger, identifying key clauses related to intellectual property rights and data privacy."
823," Evaluate the tax implications of the CVS Health-Aetna merger for both companies, considering both short-term and long-term effects."
824, Identify and analyze any significant litigation involving CVS Health or Aetna related to healthcare fraud and abuse since their merger.
825,Analyze Cigna and Express Scripts' financial statements to identify potential conflicts of interest arising from their business relationship.
826," Summarize all significant legal challenges faced by Cigna and Express Scripts in the last five years, detailing outcomes and financial impacts."
827, Assess the impact of recent healthcare legislation on Cigna and Express Scripts' profitability and compliance.
828," Compare Cigna and Express Scripts' debt-to-equity ratios over the past decade, identifying trends and potential implications for financial stability."
829,Determine the extent to which Cigna and Express Scripts' financial reporting adheres to GAAP and relevant regulatory standards.
830,Evaluate the potential antitrust implications of any future mergers or acquisitions involving Cigna or Express Scripts.
831," Analyze the financial performance of Cigna and Express Scripts' key business segments, identifying areas of strength and weakness."
832,"Analyze Anthem's and WellPoint's historical financial statements to identify trends in revenue, expenses, and profitability prior to their merger."
833, Summarize any legal challenges or antitrust concerns raised during or after the Anthem/WellPoint merger.
834," Assess the impact of the Anthem/WellPoint merger on shareholder value, comparing pre- and post-merger stock performance."
835,"Detail the financial restructuring undertaken by Anthem post-merger, focusing on debt levels and capital allocation strategies."
836,Identify any significant litigation or regulatory fines impacting either Anthem or WellPoint's financial performance.
837,"Evaluate the cost-effectiveness of Anthem's and WellPoint's post-merger integration strategies, considering both upfront and ongoing expenses."
838, Compare Anthem's and WellPoint's pre-merger and post-merger insurance premium pricing strategies and their impact on market share.
839,Analyze Pfizer's and Wyeth's financial statements prior to their merger to identify potential antitrust concerns.
840,Detail the legal challenges faced by Pfizer post-Wyeth acquisition related to product liability.
841," Assess the impact of the Pfizer-Wyeth merger on shareholder value, considering both short-term and long-term effects."
842, Compare Pfizer's and Wyeth's pre-merger litigation history to assess potential future legal risks for the combined entity.
843," Quantify the tax implications of the Pfizer-Wyeth merger, including any adjustments or write-offs."
844, Examine the intellectual property portfolio integration strategy following the Pfizer-Wyeth merger and its financial impact.
845, Evaluate any significant changes in Pfizer's financial reporting practices post-Wyeth acquisition and their compliance with relevant regulations.
846,Analyze Glaxo Wellcome and SmithKline Beecham's pre-merger financial statements to identify potential antitrust concerns.
847, Assess the legal challenges faced by the merged entity (GlaxoSmithKline) post-merger concerning intellectual property rights.
848, Determine the impact of the Glaxo Wellcome and SmithKline Beecham merger on shareholder value in the short-term and long-term.
849," Compare the financial performance of Glaxo Wellcome and SmithKline Beecham before and after the merger, focusing on key profitability metrics."
850, Identify any significant litigation or legal settlements involving GlaxoSmithKline related to its pre-merger entities’ activities.
851," Evaluate the tax implications of the Glaxo Wellcome and SmithKline Beecham merger, including any restructuring or tax optimization strategies employed."
852, Analyze the regulatory approvals required for the Glaxo Wellcome and SmithKline Beecham merger and any subsequent challenges encountered.
853,"Analyze Novartis' and Alcon's historical litigation involving intellectual property rights, detailing settlements and judgments."
854," Compare the financial performance (revenue, profit margins, R&D expenditure) of Novartis and Alcon over the past five years."
855, Assess the tax implications of Alcon's current operational structure as a subsidiary of Novartis.
856, Identify key financial covenants and restrictions in Novartis' and Alcon's debt agreements.
857," Evaluate the impact of recent regulatory changes (e.g., healthcare reforms) on the financial projections of Novartis and Alcon."
858, Summarize any significant accounting changes or restatements made by Novartis or Alcon in recent years.
859, Determine the level of shareholder activism and related litigation directed at Novartis or Alcon in the last decade.
860,Analyze the financial impact of the Sanofi-Aventis merger on shareholder value in the first five years post-merger.
861," Detail any significant legal challenges faced by Sanofi-Aventis following their merger, including antitrust concerns and litigation."
862, Assess the post-merger accounting practices of Sanofi-Aventis for compliance with IFRS standards.
863, Identify and quantify any write-downs or impairments of assets recorded by Sanofi-Aventis in the years following the merger.
864,Summarize any class-action lawsuits or major securities litigation involving Sanofi-Aventis post-merger.
865," Evaluate the effectiveness of Sanofi-Aventis's tax strategies following the merger, including any tax avoidance allegations."
866, Compare the pre- and post-merger debt levels and credit ratings of Sanofi-Aventis.
867,"Analyze AbbVie's and Allergan's financial statements for the last five years to identify trends in revenue, profitability, and debt levels."
868, Assess the legal implications of Allergan's past product liability lawsuits on AbbVie's current financial standing.
869," Determine the tax implications of the AbbVie-Allergan merger, including any potential tax liabilities or benefits."
870, Compare AbbVie's and Allergan's corporate governance structures and identify potential conflicts of interest post-merger.
871, Evaluate the antitrust concerns surrounding the AbbVie-Allergan merger and the regulatory responses.
872," Analyze the impact of intellectual property rights on the financial performance of AbbVie and Allergan, both pre- and post-merger."
873, Identify any significant legal challenges faced by either AbbVie or Allergan in the last three years and assess their financial impact.
874,Analyze Johnson & Johnson's and Actelion's financial statements to identify potential antitrust concerns related to a hypothetical merger.
875, What were the key legal and financial terms of Actelion's acquisition by Johnson & Johnson?
876, Assess the impact of Johnson & Johnson's acquisition of Actelion on its debt-to-equity ratio and credit rating.
877, Identify any litigation or regulatory investigations involving Johnson & Johnson or Actelion related to the acquisition.
878, Compare the pre- and post-acquisition financial performance of Actelion under Johnson & Johnson's ownership.
879, Evaluate the tax implications of the Johnson & Johnson-Actelion transaction for both companies.
880, What were the major financial projections made by Johnson & Johnson regarding Actelion's contribution to its overall financial performance post-acquisition and how did these compare to actual results?
881,Analyze Bayer's post-Monsanto acquisition litigation costs and their impact on profitability.
882, Detail the financial restructuring undertaken by Bayer following the Monsanto acquisition.
883, Assess the impact of antitrust lawsuits against Bayer related to Monsanto's Roundup herbicide on Bayer's financial statements.
884, Compare Bayer's and Monsanto's pre-merger financial ratios and identify key differences.
885, Examine the long-term debt obligations of Bayer stemming from the Monsanto acquisition.
886, Evaluate the success of Bayer's integration of Monsanto's intellectual property portfolio.
887, Quantify the changes in Bayer's shareholder value following the Monsanto acquisition.
888,Analyze Dow Chemical's and DuPont's financial statements from the period surrounding their merger to identify any material misstatements or inconsistencies.
889," Assess the legal challenges faced by Dow and DuPont post-merger, including antitrust lawsuits and shareholder litigation, and their respective outcomes."
890," Quantify the impact of the Dow-DuPont merger on shareholder value, considering both short-term and long-term effects."
891," Examine the divestitures undertaken by Dow and DuPont following their merger, evaluating their financial performance and strategic rationale."
892," Compare and contrast the financial reporting practices of Dow and DuPont before and after the merger, identifying any significant changes."
893, Identify and analyze any significant legal settlements or judgments involving Dow and DuPont in the five years following their merger.
894," Evaluate the effectiveness of Dow and DuPont's post-merger integration strategies from a purely financial perspective, focusing on cost-cutting measures and revenue generation."
895,"Analyze Praxair and Linde's financial statements for the past five years, identifying trends in revenue, profitability, and debt levels."
896,Summarize any legal challenges or antitrust concerns faced by Praxair and Linde during their merger process.
897,"Evaluate the impact of the Praxair-Linde merger on shareholder value, comparing pre- and post-merger stock performance."
898,"Identify key provisions within the legal agreements governing the Praxair-Linde merger, focusing on regulatory approvals and antitrust stipulations."
899,Assess the financial restructuring undertaken by either Praxair or Linde (prior to the merger) and its impact on their credit ratings.
900,"Analyze the tax implications of the Praxair-Linde merger, considering both short-term and long-term effects."
901," Compare the post-merger financial performance of Praxair-Linde with its major competitors, focusing on key financial ratios."
902,"Analyze Chevron's and Texaco's historical legal battles regarding environmental liabilities, quantifying the financial impact on each company."
903, Compare and contrast Chevron and Texaco's financial reporting practices regarding reserves accounting over the past decade.
904, Assess the tax implications of any significant acquisitions or divestitures undertaken by Chevron and Texaco since 2010.
905,"Identify and analyze any significant shareholder lawsuits against either Chevron or Texaco in the last 20 years, detailing the claims and outcomes."
906,"Evaluate the effectiveness of Chevron's and Texaco's lobbying efforts on energy-related legislation, referencing specific legislative actions and financial disclosures."
907," Quantify the financial impact of environmental regulations on Chevron and Texaco's profitability, comparing their performance to industry peers."
908," Analyze the financial performance of Chevron and Texaco following the merger, focusing on key performance indicators (KPIs) and identifying any significant deviations from pre-merger projections."
909,"Analyze ExxonMobil's legal challenges related to climate change litigation in the past five years, detailing the outcomes and financial implications of each case."
910, Assess the impact of recent changes in international tax regulations on ExxonMobil's financial reporting and profitability.
911, Identify and quantify ExxonMobil's exposure to financial risk stemming from fluctuating oil prices and geopolitical instability over the last decade.
912," Compare ExxonMobil's capital expenditure (CAPEX) allocation strategy across different energy sectors (oil, gas, renewables) in the last three years, highlighting shifts in strategic priorities."
913, Evaluate the effectiveness of ExxonMobil's lobbying efforts on environmental regulations and their influence on the company's financial performance.
914," Examine ExxonMobil's debt structure and credit rating over the past 10 years, assessing the company's financial leverage and risk profile."
915, Summarize any significant accounting changes or restatements made by ExxonMobil in the last five years and their impact on reported financial results.
916,Analyze BP's and Amoco's financial statements pre- and post-merger to identify the impact on shareholder value.
917, Identify any significant legal challenges faced by BP or Amoco (separately or post-merger) related to environmental regulations.
918," Assess the tax implications of the BP and Amoco merger, including any adjustments or disputes."
919, Evaluate the effectiveness of BP's and Amoco's (before and after merger)  disclosure practices concerning financial risks in their SEC filings.
920,Determine the impact of major oil spills (Deepwater Horizon etc.) on BP's financial statements and subsequent legal settlements.
921," Compare the financial performance of BP and Amoco before and after the merger, highlighting key performance indicators."
922, Analyze the legal structure of the BP and Amoco merger and any subsequent restructuring initiatives.
923,"Analyze the tax implications of the Royal Dutch Shell and BG Group merger, including any adjustments to reported earnings and tax liabilities."
924," Determine the impact of the Royal Dutch Shell and BG Group merger on shareholder value, comparing pre- and post-merger performance metrics."
925,Identify any antitrust concerns or regulatory hurdles faced by Royal Dutch Shell during or after the BG Group acquisition.
926," Assess the financial restructuring undertaken by Royal Dutch Shell post-BG Group acquisition, including changes to debt, equity, and capital allocation."
927,Evaluate the accounting treatment of goodwill and intangible assets resulting from the Royal Dutch Shell and BG Group merger.
928, Analyze litigation risks faced by Royal Dutch Shell related to the BG Group acquisition or subsequent operations.
929,Summarize the key financial covenants and conditions included in the financing agreements supporting the Royal Dutch Shell and BG Group merger.
930,"Analyze ConocoPhillips' (post-merger) litigation history, focusing on settlements and judgments impacting financial performance."
931,"Detail ConocoPhillips' capital expenditure plans for the next five years, identifying potential financial risks and opportunities."
932,Assess the impact of recent environmental regulations on ConocoPhillips' financial statements and legal compliance.
933,"Summarize ConocoPhillips' debt structure and credit ratings, evaluating its long-term financial stability."
934,Evaluate the effectiveness of ConocoPhillips' tax strategies and their impact on its overall profitability.
935,Identify key financial covenants in ConocoPhillips' loan agreements and assess the company's compliance.
936,Analyze ConocoPhillips' disclosures regarding potential liabilities related to climate change litigation.
937,Analyze AT&T and BellSouth's pre-merger financial statements to identify potential antitrust concerns.
938, Detail the legal challenges faced by AT&T and BellSouth during their merger process.
939," Assess the impact of the AT&T-BellSouth merger on shareholder value, considering both short-term and long-term effects."
940, Compare the financial performance of AT&T post-merger with its performance before the BellSouth acquisition.
941, Examine the regulatory approvals and conditions required for the AT&T and BellSouth merger.
942, Quantify the cost savings realized by AT&T following its acquisition of BellSouth.
943, Identify any litigation or legal disputes stemming from the AT&T-BellSouth merger.
944,What were the total legal fees incurred by Sprint and Nextel related to antitrust litigation during their merger process?
945,Analyze Sprint and Nextel's post-merger financial statements to identify any material weaknesses in internal controls over financial reporting.
946," Summarize any significant changes in Sprint and Nextel's accounting policies following their merger, and assess the impact on reported financial results."
947, What were the key provisions of the shareholder agreements related to the Sprint and Nextel merger?
948, Identify any significant legal challenges faced by Sprint or Nextel (individually or post-merger) related to intellectual property rights.
949, Quantify the impact of regulatory fines or penalties on Sprint and Nextel's financial performance in the five years following their merger.
950," Analyze the disclosures in Sprint and Nextel's SEC filings regarding their debt obligations and credit ratings, both pre and post-merger."
